CREATE TABLE accounts(
  account_id VARCHAR2(6) PRIMARY KEY,
  bal NUMBER(11,2));

INSERT INTO accounts VALUES('A1',5000);
INSERT INTO accounts VALUES('A2',200);
INSERT INTO accounts VALUES('A3',1500);
INSERT INTO accounts VALUES('A4',500);

SELECT * FROM accounts;

ACCOUN        BAL
------ ----------
A1           5000
A2            200
A3           1500
A4            500

DECLARE
    v_account_number VARCHAR2(6);
    v_minimum_balance NUMBER := 500;
    v_current_balance NUMBER(11,2);
BEGIN
    FOR rec IN (SELECT account_id,bal FROM accounts)
    LOOP
      v_current_balance:=rec.bal;
      v_account_number:=rec.account_id;

      IF v_current_balance < v_minimum_balance THEN
          v_current_balance := v_current_balance - 100;

          UPDATE accounts
          SET bal = v_current_balance
          WHERE account_id = v_account_number;

          DBMS_OUTPUT.PUT_LINE('Rs. 100 deducted. New balance: ' || v_current_balance);
      ELSE
          DBMS_OUTPUT.PUT_LINE('Balance is sufficient. No deduction.');
      END IF;
    END LOOP;
END;
/

Balance is sufficient. No deduction.
Rs. 100 deducted. New balance: 100
Balance is sufficient. No deduction.
Balance is sufficient. No deduction.

PL/SQL procedure successfully completed.

SELECT * FROM accounts;

ACCOUN        BAL
------ ----------
A1           5000
A2            100
A3           1500
A4            500